{
  "$schema": "https://json-schema.org/draft/2020-12/schema",
  "$id": "https://archcontext.dev/schemas/runtime/architecture-refresh-signal.schema.json",
  "title": "ArchitectureRefreshSignalV1",
  "type": "object",
  "additionalProperties": false,
  "required": ["schemaVersion", "signalId", "idempotencyKey", "mode", "repository", "worktree", "cause", "reasonCodes", "affectedNodeIds", "refreshTargets", "baseDigests", "resultingDigests", "projectionReceiptDigest"],
  "properties": {
    "schemaVersion": { "const": "archcontext.architecture-refresh-signal/v1" },
    "signalId": { "$ref": "#/$defs/digest" },
    "idempotencyKey": { "$ref": "#/$defs/digest" },
    "mode": { "enum": ["human-action-required", "refresh-required"] },
    "repository": {
      "type": "object",
      "additionalProperties": false,
      "required": ["repositoryId"],
      "properties": { "repositoryId": { "type": "string", "minLength": 1 } }
    },
    "worktree": {
      "type": "object",
      "additionalProperties": false,
      "required": ["workspaceId", "headSha", "worktreeDigest"],
      "properties": {
        "workspaceId": { "type": "string", "minLength": 1 },
        "headSha": { "type": "string", "pattern": "^[a-f0-9]{40}$" },
        "worktreeDigest": { "$ref": "#/$defs/digest" }
      }
    },
    "cause": { "enum": ["accepted-semantic-delta", "unresolved-major-candidate", "verified-flow-proof-delta"] },
    "acceptedChange": { "$ref": "#/$defs/acceptedChange" },
    "reasonCodes": {
      "type": "array",
      "minItems": 1,
      "uniqueItems": true,
      "items": { "$ref": "#/$defs/reasonCode" }
    },
    "affectedNodeIds": {
      "type": "array",
      "minItems": 1,
      "uniqueItems": true,
      "items": { "type": "string", "minLength": 1 }
    },
    "capabilities": {
      "type": "array",
      "minItems": 1,
      "description": "The observed per-capability breakdown of this signal, sorted by capabilityId (enforced by architectureRefreshSignalInvariantIssues). Part of the signal identity; signals committed before it existed lack it.",
      "items": { "$ref": "#/$defs/capabilityChange" }
    },
    "refreshTargets": {
      "type": "array",
      "minItems": 1,
      "uniqueItems": true,
      "items": { "enum": ["architecture-contract-context", "architecture-readiness", "architecture-request-index", "capability-context", "capability-index"] }
    },
    "baseDigests": { "$ref": "#/$defs/digestSet" },
    "resultingDigests": { "$ref": "#/$defs/digestSet" },
    "projectionReceiptDigest": { "$ref": "#/$defs/digest" }
  },
  "allOf": [
    {
      "if": { "properties": { "cause": { "const": "unresolved-major-candidate" } }, "required": ["cause"] },
      "then": { "properties": { "mode": { "const": "human-action-required" } }, "not": { "required": ["acceptedChange"] } },
      "else": { "properties": { "mode": { "const": "refresh-required" } }, "required": ["acceptedChange"] }
    }
  ],
  "$defs": {
    "digest": { "type": "string", "pattern": "^sha256:[a-f0-9]{64}$" },
"capabilityChange": {
      "type": "object",
      "additionalProperties": false,
      "required": ["capabilityId", "reasonCodes", "changedFacets", "proofStatusBefore", "proofStatusAfter"],
      "properties": {
        "capabilityId": { "type": "string", "minLength": 1 },
        "reasonCodes": { "type": "array", "uniqueItems": true, "items": { "$ref": "#/$defs/reasonCode" } },
        "changedFacets": { "type": "array", "uniqueItems": true, "items": { "enum": ["constraints", "entrypoints", "interfaces", "lifecycle", "names", "ownership", "placement", "relations", "responsibilities", "riskBoundaries"] } },
        "proofStatusBefore": { "anyOf": [{ "type": "null" }, { "$ref": "#/$defs/proofStatus" }] },
        "proofStatusAfter": { "anyOf": [{ "type": "null" }, { "$ref": "#/$defs/proofStatus" }] }
      }
    },
    "proofStatus": {
      "type": "object",
      "additionalProperties": false,
      "required": ["p1", "p2"],
      "properties": {
        "p1": { "enum": ["proven", "unprovable"] },
        "p2": { "enum": ["not-applicable", "proven", "unprovable"] }
      }
    },
    "reasonCode": {
      "enum": ["constraint-changed", "entrypoint-changed", "interface-changed", "lifecycle-changed", "node-added", "node-moved", "node-removed", "node-renamed", "ownership-changed", "relation-changed", "responsibility-changed", "risk-boundary-changed", "verified-flow-proof-changed"]
    },
    "acceptedChange": {
      "type": "object",
      "additionalProperties": false,
      "required": ["changeSetId", "eventId", "reasonCodes", "affectedNodeIds"],
      "properties": {
        "changeSetId": { "type": "string", "minLength": 1 },
        "eventId": { "type": "string", "minLength": 1 },
        "reasonCodes": { "type": "array", "minItems": 1, "uniqueItems": true, "items": { "$ref": "#/$defs/reasonCode" } },
        "affectedNodeIds": { "type": "array", "minItems": 1, "uniqueItems": true, "items": { "type": "string", "minLength": 1 } }
      }
    },
    "digestSet": {
      "type": "object",
      "additionalProperties": false,
      "required": ["modelDigest", "sourceTreeDigest", "flowProofDigest", "projectionDigest"],
      "properties": {
        "modelDigest": { "$ref": "#/$defs/digest" },
        "sourceTreeDigest": { "$ref": "#/$defs/digest" },
        "flowProofDigest": { "$ref": "#/$defs/digest" },
        "projectionDigest": { "$ref": "#/$defs/digest" }
      }
    }
  }
}
